{
  "about": "Every inspiration in inspo/ (generated by tools/catalog build; never hand-edit). Media is in the library as kind reference: never shipped.",
  "count": 2,
  "counts": {
    "kind": {
      "video": 2
    },
    "status": {
      "active": 2
    }
  },
  "inspo": [
    {
      "id": "inspo.app.scan-real-probe.v1",
      "title": "Real photo-scan roll from the app (probe recording): the true timing",
      "kind": "video",
      "status": "active",
      "url": null,
      "asset": "reference.app.scan-real-probe.v1",
      "files": [
        {
          "role": "original",
          "path": "references/scan-real-probe/scan-real.v1.mp4",
          "mime": "video/mp4"
        }
      ],
      "cover": "references/scan-real-probe-sheet/scan-real-probe-sheet.v1.jpg",
      "love": [
        "The scan roll at the app's real speed: photos racing past while Zee's magnifier works",
        "Photos lifting into Picked: the honest timing to cut motion against"
      ],
      "techniques": {
        "pacing": [
          "Real app speed: match motion-graphic scan moments to this, never faster than the app"
        ]
      },
      "useFor": [
        "concept:c1",
        "ad:pop-out"
      ],
      "tags": [
        "own-app",
        "timing",
        "photo-scan",
        "probe"
      ],
      "links": [],
      "addedBy": "claude-code",
      "addedAt": "2026-10-15",
      "source": "recorded from the app with a dev probe (marketing/videos capture), 2026-10-15",
      "hasBreakdown": true,
      "path": "inspo/inspo.app.scan-real-probe.v1.md",
      "body": "Our own app, kept as a timing reference (marked not-for-cuts at the source: it came from a dev probe, not Emma's real account). For cuts use the real-account clips: tools/catalog search --kind footage --text scan.\n\n<!-- breakdown:start (written by tools/inspo breakdown on 2026-10-15; re-running replaces this section) -->\n## Breakdown\n\n- **Length:** 27.67 s · 59.94 fps (1659 frames)\n- **Frame:** 1320×2868 (110:239, vertical) · h264\n- **Audio:** none\n- **Cuts:** 0 hard cuts (scene change > 0.3)\n- **Shots:** 1 · average 27.67 s · shortest 27.67 s · longest 27.67 s · 0.00 cuts per 10 s\n- **Hook window:** 0 cut(s) in the first 3 s\n- **Contact sheet:** 24 tiles, one every 1.15 s (`reference.app.scan-real-probe-sheet.v1`)\n- **Colour at six moments:** #CBCAC4 #C2C1BD #C5C7C5 #C3C3BF #C4C7C6 #C4C2BC (each frame's average, 1/7 … 6/7 through)\n\n![contact sheet](../library/references/scan-real-probe-sheet/scan-real-probe-sheet.v1.jpg)\n\nBy eye still to do: transitions, type, colour (`tools/inspo edit inspo.app.scan-real-probe.v1 --transition … --pacing … --type … --colour …`).\n<!-- breakdown:end -->\n"
    },
    {
      "id": "inspo.creator.pop-off-reel.v1",
      "title": "Creator reel \"how to: Pop Off\" (Edits tutorial): pop-out-and-return hook",
      "kind": "video",
      "status": "active",
      "url": null,
      "asset": "reference.creator.pop-off-reel.v1",
      "files": [
        {
          "role": "original",
          "path": "references/pop-off-reel/source.v1.mp4",
          "mime": "video/mp4"
        },
        {
          "role": "frame",
          "path": "references/pop-off-reel/audio-wave-spectrogram.v1.jpg",
          "mime": "image/jpeg"
        },
        {
          "role": "frame",
          "path": "references/pop-off-reel/hook-10fps.v1.jpg",
          "mime": "image/jpeg"
        },
        {
          "role": "frame",
          "path": "references/pop-off-reel/sheet-1.v1.jpg",
          "mime": "image/jpeg"
        },
        {
          "role": "frame",
          "path": "references/pop-off-reel/sheet-2.v1.jpg",
          "mime": "image/jpeg"
        },
        {
          "role": "frame",
          "path": "references/pop-off-reel/sheet-3.v1.jpg",
          "mime": "image/jpeg"
        },
        {
          "role": "frame",
          "path": "references/pop-off-reel/sheet-4.v1.jpg",
          "mime": "image/jpeg"
        },
        {
          "role": "frame",
          "path": "references/pop-off-reel/shot2-10fps.v1.jpg",
          "mime": "image/jpeg"
        }
      ],
      "cover": "references/pop-off-reel/sheet-1.v1.jpg",
      "love": [
        "Cut-outs pop out of the phone screen with an overshoot, hold, and sink back home",
        "A new outfit every 2 beats, overlapping, so there is never an empty beat",
        "Picture first, words at 1 s: the title types on only after the visual hooks you",
        "The title sits BEHIND her head, which reads as depth",
        "Flash, then a tilted print drops in and sticks",
        "Scan dots, then an outline traced round the cut-out"
      ],
      "techniques": {
        "transitions": [
          "pop-out-return",
          "type-behind-subject",
          "flash-print-land",
          "scan-trace",
          "ellipse-draw-on",
          "stroke-frame",
          "hard-cut-on-kick"
        ],
        "pacing": [
          "Hook is the first 3.8 s, music only",
          "One outfit per 2 beats (0.93 s) at 129 BPM, overlapping",
          "Hard cuts land within a frame of a kick"
        ],
        "type": [
          "Tall white condensed display face, typed on letter by letter at 1.0–1.6 s, behind the subject",
          "Captions: white bold sans with a soft shadow, 1–4 words at a time"
        ],
        "colour": [
          "Cool grey-white plate under the phone so skin and outfits pop",
          "Natural warm golden-hour grade, no stylised look"
        ]
      },
      "useFor": [
        "concept:c14",
        "ad:pop-out"
      ],
      "tags": [
        "reel",
        "tutorial",
        "pop-out",
        "hook",
        "transitions",
        "cutout"
      ],
      "links": [
        {
          "label": "Breakdown with contact sheets (phone page)",
          "url": "https://claude.ai/artifact/BfnhPC2vDLECNgQnyC5Fet"
        }
      ],
      "addedBy": "claude-code",
      "addedAt": "2026-10-15",
      "source": "the founder, on WhatsApp (2026-10-15)",
      "hasBreakdown": true,
      "path": "inspo/inspo.creator.pop-off-reel.v1.md",
      "body": "**What it is.** A creator's \"how to: Pop Off\" tutorial for Meta's Edits app (filmed in Dubai), sent by the founder on WhatsApp. Not an ad and not a fashion reference: only the 3.8-second opening is worth taking. Full breakdown with contact sheets: the phone page linked above.\n\n**The hook (0.00–3.83 s).** A top-down still of an iPhone on a closed laptop shows her Instagram grid. Cut-out versions of her in four outfits rise out of the screen one at a time, pose with live motion, and shrink back in: each scales from about 15% to 100% in about 0.2 s with overshoot, holds about 0.5 s, then returns. The next outfit starts rising before the last has gone, so there's never an empty beat (one outfit per 2 beats at 129 BPM). \"how to: Pop Off\" types on letter by letter at 1.0–1.6 s, in a white, tall, condensed display face, behind her head. Hard cut on the kick.\n\n**The rest (3.83–32.3 s).** Step 1 jump cuts on a rooftop; step 2 photos flash white and drop in as tilted prints; an Edits screen recording (scan dots, a yellow outline traced round the cut-out, hand-drawn ellipses circling buttons); the export ends inside a rounded phone outline with a gradient stroke tracing the frame.\n\n**Mapped to Curate.**\n- Pop out and go back home: pieces lifting out of Emma's photos; the Try-ons opener (she rises out of her selfie in look 1, sinks back, rises in look 2). Concept c14 \"Pop out\", ad `pop-out`.\n- A new look every 2 beats, overlapping: the photo scan roll and Try-ons.\n- Title behind the subject: \"Your wardrobe is ready\" and the Wardrobe float (`TitleBehind`).\n- Flash, then a tilted print that sticks: the chat look card arriving (`FlashPrint`).\n- Scan dots, then an outline trace: the photo scan and Zee's thinking, without the percentage (never show the pipeline) (`ScanTrace`).\n- Hand-drawn ellipse (`Ellipse`) and a gradient stroke round a frame (`StrokeFrame`): the selfie ring, the closing frame.\n\n**Avoid.** The tutorial body (screen-recorded UI with spoken steps); Instagram/Edits gradients and branding; their caption style as-is; other people's grids or faces; ending without a brand or Zee card; progress percentages.\n\n<!-- breakdown:start (written by tools/inspo breakdown on 2026-10-15; re-running replaces this section) -->\n## Breakdown\n\n- **Length:** 32.30 s · 30 fps (969 frames)\n- **Frame:** 576×1024 (9:16, vertical) · h264\n- **Audio:** aac, stereo, 44.1 kHz · -14.2 LUFS integrated\n- **Cuts:** 6 hard cuts (scene change > 0.3) at 3.83 s, 6.20 s, 8.90 s, 11.73 s, 13.03 s, 31.60 s\n- **Shots:** 7 · average 4.61 s · shortest 0.70 s · longest 18.57 s · 1.86 cuts per 10 s\n- **Hook window:** 0 cut(s) in the first 3 s; first cut at 3.83 s\n- **Frames:** 7 image(s) already with the asset (contact sheets): `sheet-1.v1.jpg`, `sheet-2.v1.jpg`, `sheet-3.v1.jpg`, `sheet-4.v1.jpg`, `hook-10fps.v1.jpg`, `shot2-10fps.v1.jpg`, `audio-wave-spectrogram.v1.jpg`\n- **Colour at six moments:** #9B9690 #797374 #3C3D3E #202021 #3F3E3B #3E3E3F (each frame's average, 1/7 … 6/7 through)\n\n![contact sheet](../library/references/pop-off-reel/sheet-1.v1.jpg)\n<!-- breakdown:end -->\n"
    }
  ]
}
